{
  "contract": {
    "envelope_key": "movie",
    "id": "example.conformance:Movie/v1",
    "model": null,
    "profile": "frontmatter-md",
    "schema_path": "schema.yaml",
    "status": "enforced"
  },
  "contract_id": "example.conformance:Movie/v1",
  "document_metadata": {
    "contract": "example.conformance:Movie/v1",
    "envelope": "movie",
    "extensions": {
      "com.example.review": {
        "labels": [
          "classic",
          "family"
        ]
      },
      "https://schemas.example/extensions/source/v1": "conformance"
    },
    "schema": "schema.yaml",
    "status": "enforced"
  },
  "path": "artifact.md",
  "profile": "frontmatter-md",
  "semantic": {
    "errors": [],
    "ok": true,
    "skipped_reason": "no_semantic_model"
  },
  "status": "enforced",
  "structural": {
    "engine": "json_schema",
    "errors": [],
    "ok": true,
    "skipped_reason": null
  },
  "values": {
    "title": "Spirited Away",
    "year": 2001
  },
  "warnings": []
}
