{
  "contract": {
    "envelope_key": "record",
    "id": "example.conformance:Composed/v1",
    "model": null,
    "profile": "frontmatter-md",
    "schema_path": "schema.yaml",
    "status": "enforced"
  },
  "contract_id": "example.conformance:Composed/v1",
  "document_metadata": {
    "contract": "example.conformance:Composed/v1",
    "envelope": "record",
    "schema": "schema.yaml",
    "status": "enforced"
  },
  "path": "artifact.md",
  "profile": "frontmatter-md",
  "semantic": {
    "errors": [],
    "ok": true,
    "skipped_reason": "no_semantic_model"
  },
  "status": "enforced",
  "structural": {
    "engine": "json_schema",
    "errors": [
      {
        "kind": "schema_violation",
        "message": "object has properties that are not allowed",
        "path": [],
        "validator": "unevaluatedProperties",
        "validator_value": false,
        "value": {
          "a": "alpha",
          "b": 2,
          "extra": "rejected"
        }
      }
    ],
    "ok": false,
    "skipped_reason": null
  },
  "values": {
    "a": "alpha",
    "b": 2,
    "extra": "rejected"
  },
  "warnings": []
}
