{
  "contract": {
    "envelope_key": "record",
    "id": "example.conformance:PureRecord/v1",
    "model": null,
    "profile": "pure-yaml",
    "schema_path": "schema.yaml",
    "status": "enforced"
  },
  "contract_id": "example.conformance:PureRecord/v1",
  "document_metadata": {
    "contract": "example.conformance:PureRecord/v1",
    "envelope": "record",
    "format": "1",
    "schema": "schema.yaml",
    "status": "enforced"
  },
  "path": "artifact.yaml",
  "profile": "pure-yaml",
  "semantic": {
    "errors": [],
    "ok": true,
    "skipped_reason": "no_semantic_model"
  },
  "status": "enforced",
  "structural": {
    "engine": "json_schema",
    "errors": [],
    "ok": true,
    "skipped_reason": null
  },
  "values": {
    "active": true,
    "name": "Ada"
  },
  "warnings": []
}
