{
  "contract": {
    "envelope_key": "record",
    "id": "example.conformance:LegacyExternal/v1",
    "model": null,
    "profile": "frontmatter-md",
    "schema_path": "schema.yaml",
    "status": "enforced"
  },
  "contract_id": "example.conformance:LegacyExternal/v1",
  "document_metadata": {
    "contract": "example.conformance:LegacyExternal/v1",
    "envelope": "record",
    "schema": null,
    "status": "enforced"
  },
  "path": "artifact.md",
  "profile": "frontmatter-md",
  "semantic": {
    "errors": [],
    "ok": true,
    "skipped_reason": "no_semantic_model"
  },
  "status": "enforced",
  "structural": {
    "engine": "json_schema",
    "errors": [
      {
        "detail": "legacy_external_reference",
        "kind": "schema_invalid",
        "message": "compiled schema is outside the softschema profile",
        "reason": "profile",
        "schema_path": "/$ref"
      }
    ],
    "ok": false,
    "skipped_reason": null
  },
  "values": {},
  "warnings": []
}
