{
  "contract": {
    "envelope_key": "record",
    "id": "example.conformance:PortablePattern/v1",
    "model": null,
    "profile": "frontmatter-md",
    "schema_path": "schema.yaml",
    "status": "permissive"
  },
  "contract_id": "example.conformance:PortablePattern/v1",
  "document_metadata": {
    "contract": "example.conformance:PortablePattern/v1",
    "envelope": "record",
    "schema": "schema.yaml",
    "status": "permissive"
  },
  "path": "artifact.md",
  "profile": "frontmatter-md",
  "semantic": {
    "errors": [],
    "ok": true,
    "skipped_reason": "no_semantic_model"
  },
  "status": "permissive",
  "structural": {
    "engine": "json_schema",
    "errors": [],
    "ok": true,
    "skipped_reason": null
  },
  "values": {
    "digits": "0129",
    "dot": "😀",
    "space": " ",
    "unicode": "🙏",
    "word": "Az_09"
  },
  "warnings": []
}
