{
  "contract": {
    "envelope_key": "record",
    "id": "example.conformance:PortablePattern/v1",
    "model": null,
    "profile": "frontmatter-md",
    "schema_path": "schema.yaml",
    "status": "permissive"
  },
  "contract_id": "example.conformance:PortablePattern/v1",
  "document_metadata": {
    "contract": "example.conformance:PortablePattern/v1",
    "envelope": "record",
    "schema": "schema.yaml",
    "status": "permissive"
  },
  "path": "artifact.md",
  "profile": "frontmatter-md",
  "semantic": {
    "errors": [],
    "ok": true,
    "skipped_reason": "no_semantic_model"
  },
  "status": "permissive",
  "structural": {
    "engine": "json_schema",
    "errors": [
      {
        "kind": "schema_violation",
        "message": "value 'a\\n' does not match pattern '^a$'",
        "path": [
          "value"
        ],
        "validator": "pattern",
        "validator_value": "^a$",
        "value": "a\n"
      }
    ],
    "ok": false,
    "skipped_reason": null
  },
  "values": {
    "value": "a\n"
  },
  "warnings": []
}
